,Title,published_date,Views,Likes,favourites,Comment,published_year,published_Month
0,How to outsmart automated systems when applying for TECH jobs💪💻,2025-01-17,1310,115,0,3,2025,Jan
1,This is definitely the hardest passive income HUSTLE to break into.,2025-01-16,1756,111,0,1,2025,Jan
2,Is Python Still The King Of Coding?!👈⌨️,2025-01-16,10833,542,0,29,2025,Jan
3,Concept we're looking at today is Dynamic Typing In Python💻,2025-01-15,4510,257,0,6,2025,Jan
4,Next Income Method looks at 👉Blogging.Affiliate Marketing & Newsletters in 2025💻,2025-01-15,2566,130,0,1,2025,Jan
5,Don't be too picky. Let's break it down👆,2025-01-14,3637,271,0,11,2025,Jan
6,How to scale your coding resume if you have no Software EXPERIENCE!,2025-01-14,5280,435,0,7,2025,Jan
7,Looking at licensing your code or your API?,2025-01-13,5637,396,0,4,2025,Jan
8,Let's see how you can scale this in 2025👈📈,2025-01-13,2400,156,0,1,2025,Jan
9,Learn Ollama in 15 Minutes - Run LLM Models Locally for FREE,2025-01-13,24433,1206,0,66,2025,Jan
10,Python *ARGS & **KWARGS Concept☝,2025-01-13,10779,826,0,6,2025,Jan
11,Struggling With A Lack Of Credibility?? As A Software Dev In 2025.,2025-01-12,3462,277,0,12,2025,Jan
12,This is the last thing you want when applying for jobs in TECH!👈🤫,2025-01-12,3288,265,0,4,2025,Jan
13,Why NOT to learn Python?!?,2025-01-11,7611,421,0,16,2025,Jan
14,A bit of a weird Python Feature looking at the For/Else Concept in Python☝,2025-01-11,8060,462,0,14,2025,Jan
15,A New Coding Assistant Just Arrived...,2025-01-10,20836,729,0,44,2025,Jan
16,Let's Get Into It With Passive Income Idea One☝📲,2025-01-10,4531,329,0,2,2025,Jan
17,The next series has arrived👉 FIVE Passive Income Ideas For Programmers in 2025 💵,2025-01-10,5212,352,0,5,2025,Jan
18,Your First Step Too Backend Development Starts By Identifying This!🤞💻,2025-01-09,7308,549,0,18,2025,Jan
19,CompSci Students are you using AI as part of your workflow?!,2025-01-08,4433,341,0,9,2025,Jan
20,How to be job ready after your Computer Science Degree🎓☝️,2025-01-08,3910,350,0,9,2025,Jan
21,The BIGGEST mistake❌ that almost all CompSci Students make is focusing solely on just this.🎓☝️,2025-01-08,5775,279,0,8,2025,Jan
22,"Don't focus on the Syntax or all the fancy features , rather focus on this when programming❌🤝",2025-01-07,5376,382,0,3,2025,Jan
23,Python is an interesting language. Because if you import this look at what you get?!,2025-01-07,6440,414,0,4,2025,Jan
24,"Thinking of being a Python Developer , you are going to need to know more then just Python📈🤝",2025-01-06,8913,651,0,4,2025,Jan
25,"How I Built a Full-Stack AI App in 5 Hours (Agents, Streamlit, Python & More)",2025-01-06,20253,686,0,64,2025,Jan
26,3 Signs That Programming is RIGHT for you ✅,2025-01-06,8276,718,0,17,2025,Jan
27,You are never really gonna get anything done if you don't commit to...,2025-01-05,5315,537,0,20,2025,Jan
28,Let’s break it down. Here’s how you can monetize  your Python skills into a real income in 2025💸,2025-01-05,6782,558,0,3,2025,Jan
29,"You can’t skip this. If you’re coding in Python, you need to understand this.",2025-01-04,8636,463,0,7,2025,Jan
30,How you actually should approach programming...,2025-01-04,5642,454,0,11,2025,Jan
31,"Reddit Clone - Full Tutorial w/ TypeScript, React & Convex",2025-01-04,6719,304,0,25,2025,Jan
32,How to maximise ChatGPT for coding in 2025 ☝🙂,2025-01-03,10779,697,0,19,2025,Jan
33,This is what companies really want to see when hiring Software Engineers🤝,2025-01-03,7901,468,0,5,2025,Jan
34,This is one of my ultime favourite Python projects to add to a resume for 2025📈,2025-01-02,11674,681,0,5,2025,Jan
35,Here are 3 signs that programming is NOT for you☝,2025-01-02,16484,1072,0,30,2025,Jan
36,"If you’re aiming for Python roles, this project will refresh your skills...",2025-01-01,12626,771,0,8,2025,Jan
37,This one thing changed how I code and how quick I code.,2024-12-31,9052,471,0,14,2024,Dec
38,"If you're still doing this as a coder in 2024 , you might wanna consider doing it like this.",2024-12-30,11043,700,0,10,2024,Dec
39,Tools EVERY Software Engineer Should Know,2024-12-30,35160,1380,0,73,2024,Dec
40,To all my CompSci Students this one is for you!,2024-12-30,10599,671,0,22,2024,Dec
41,We’ve all been there 💀 Here’s how I avoid it and the mindset I’ve adopted to stay on track☝️,2024-12-30,3944,345,0,4,2024,Dec
42,"How to decide which backend language is for you? when looking at Java, Python, or JavaScript?",2024-12-29,34121,1557,0,50,2024,Dec
43,And to finish off the AI Project series.,2024-12-28,4142,207,0,1,2024,Dec
44,Please Master This MAGIC Python Feature... 🪄,2024-12-28,128264,4341,0,85,2024,Dec
45,Definitely one of my favorite AI projects to work on!,2024-12-28,5517,408,0,3,2024,Dec
46,Quick code sample on how to code a Recommendation System in Python,2024-12-27,4185,222,0,2,2024,Dec
47,Recommendation Systems. Ever watched a movie on Netflix and got suggestions for similar ones?,2024-12-27,4911,369,0,5,2024,Dec
48,Next AI Project is Image Classification in Python🔍🤖,2024-12-26,4370,320,0,2,2024,Dec
49,A quick Image Classifier code sample with TensorFlow and Keras in Python💻,2024-12-26,3564,202,0,3,2024,Dec
50,Should you join a Coding Bootcamp in 2025?,2024-12-26,6235,387,0,18,2024,Dec
51,Merry Christmas Tech With Tim Family🎄 What is your plans this Christmas? Comment down below👇,2024-12-25,5500,331,0,5,2024,Dec
52,So next up on our AI Project Series we have. AI Voice Assistant🤖,2024-12-24,4313,328,0,3,2024,Dec
53,Top 5 Passive Income Streams for Developers,2024-12-24,30137,1271,0,68,2024,Dec
54,The Truth About Comp Sci in 2025 👀 #compsci #computerscience#fyp #tech,2024-12-24,20221,1015,0,29,2024,Dec
55,Here is why I switched from JavaScript to TypeScript,2024-12-23,16078,817,0,21,2024,Dec
56,Sentiment Analysis Code Sample - Part 2,2024-12-22,3553,192,0,4,2024,Dec
57,"This week, we’re diving into AI projects! A fun series on projects to challenge your skills.",2024-12-22,6090,538,0,10,2024,Dec
58,How To Get Good at Programming - Without Tutorial Hell...,2024-12-22,25725,1247,0,75,2024,Dec
59,Want to stand out? Your network will take you further than any degree.,2024-12-22,2622,183,0,4,2024,Dec
60,How one of my students landed their first coding job just 3 weeks after finishing my course!,2024-12-21,9768,508,0,7,2024,Dec
61,Have you ever written all your methods in only 4 lines?,2024-12-21,10579,500,0,4,2024,Dec
62,Stop Watching Coding Tutorials  ✅👨‍💻,2024-12-20,8258,654,0,13,2024,Dec
63,"Ever wondered how to get access to the class, not just its instances?",2024-12-20,5289,293,0,1,2024,Dec
64,10 Python Concepts You NEED To Know in 2025,2024-12-20,27717,1223,0,41,2024,Dec
65,It's normal to struggle with imposter syndrome...,2024-12-19,2827,287,0,13,2024,Dec
66,Master these Python functions to elevate your programming skills and enhance your projects🤝🤫,2024-12-19,4550,320,0,8,2024,Dec
67,I’d say this is hands down one of the best ways to learn coding ☝️,2024-12-19,4709,389,0,7,2024,Dec
68,Do you know another name for Dunder Methods?,2024-12-18,9395,626,0,14,2024,Dec
69,Did you master this Python function?,2024-12-18,4296,371,0,3,2024,Dec
70,Learn Programming the Right Way...,2024-12-18,10956,537,0,29,2024,Dec
71,Avoid doing this when starting out with coding🤫✅,2024-12-17,3695,362,0,10,2024,Dec
72,This is where most beginner coders get it wrong when starting out,2024-12-16,3702,283,0,4,2024,Dec
73,"ADVANCED Python AI Agent Tutorial - Using RAG, Langflow & Multi-Agents",2024-12-16,61799,2358,0,134,2024,Dec
74,This is a pretty straightforward function.,2024-12-16,5213,358,0,3,2024,Dec
75,"Rather, try doing this when coding—it will change the game for how you code.",2024-12-15,9646,613,0,10,2024,Dec
76,A simple yet super handy function!,2024-12-15,5740,388,0,3,2024,Dec
77,Feel like you’re stuck watching YouTube tutorials but not actually coding?,2024-12-14,4720,282,0,4,2024,Dec
78,Let’s dive into Python’s Map ( ) Function!,2024-12-14,11839,961,0,8,2024,Dec
79,The tech world never slows down.,2024-12-13,5232,344,0,6,2024,Dec
80,Mess around with different languages and frameworks first when you just start out,2024-12-12,7288,467,0,9,2024,Dec
81,Wondering how long it’ll take to land your first job if you start today?,2024-12-12,5989,319,0,10,2024,Dec
82,Coding is Changing Fast... AI Agents Explained,2024-12-12,78163,2008,0,78,2024,Dec
83,"frontend first, or dive straight into backend?",2024-12-11,8839,445,0,14,2024,Dec
84,Let me show you how this function can make your life easier.,2024-12-11,7199,525,0,8,2024,Dec
85,What does the future hold for software devs?,2024-12-10,17308,746,0,12,2024,Dec
86,How to Build a Freelance Coding Career - ft. @NicolaiAI,2024-12-10,23583,994,0,59,2024,Dec
87,Let me show you this one-liner trick!,2024-12-10,12401,823,0,18,2024,Dec
88,The 3 biggest mistakes people make when starting out with software engineering,2024-12-09,5284,466,0,11,2024,Dec
89,Stop learning Python👀,2024-12-09,34835,1562,0,87,2024,Dec
90,My top 3 things I focus on when coding,2024-12-08,9193,551,0,9,2024,Dec
91,Game-changing Python tip for all programmers!,2024-12-08,26319,1481,0,17,2024,Dec
92,"If I started from scratch in 2024/2025, this is how I would do it🤝👀",2024-12-07,4760,240,0,6,2024,Dec
93,The first thing I would do if I had to build a software system right now,2024-12-07,9163,702,0,5,2024,Dec
94,The best piece of advice I have for both beginner and advanced programmers is...,2024-12-06,4103,266,0,6,2024,Dec
95,Best framework when building projects on a time crunch,2024-12-06,11904,617,0,12,2024,Dec
96,"Shopify offered me a backend developer position, and here's how I landed it!",2024-12-05,17142,957,0,18,2024,Dec
97,"This one is for the beginner coders , a quick Python trick🤝",2024-12-05,19118,1052,0,13,2024,Dec
98,"If there’s one piece of advice I’d share, it’s this...",2024-12-04,2506,114,0,1,2024,Dec
99,Let's talk about common Python mistakes we all make,2024-12-04,18335,1152,0,10,2024,Dec
100,This is what really matters when starting out with coding,2024-12-03,2379,137,0,4,2024,Dec
101,12 Years of Software Engineering Advice in 8 Minutes,2024-12-03,23371,1150,0,52,2024,Dec
102,What is the hardest project you have build in 2024? Comment down below🤫,2024-12-02,4717,406,0,18,2024,Dec
103,Want to impress her? Turn this feature on in VS Code,2024-12-02,10116,599,0,29,2024,Dec
104,Who’s that one person you’d go to when your code just doesn’t work?,2024-12-01,3075,260,0,7,2024,Dec
105,A Monitor Designed Just for Programmers? | BenQ RD Series Review,2024-12-01,12769,341,0,34,2024,Dec
106,Three things you NEED to start doing as a dev,2024-12-01,7388,544,0,33,2024,Dec
107,Focus on becoming THIS first and a programmer second,2024-11-30,5959,497,0,7,2024,Nov
108,So... is Python still the move for beginner programmers in 2024/2025?,2024-11-30,9802,494,0,14,2024,Nov
109,Understanding closures in Python,2024-11-29,16358,869,0,13,2024,Nov
110,How To Make Money From Python - A Complete Guide,2024-11-28,135749,5540,0,133,2024,Nov
111,What is your end goal? Why are you doing this? Why are you LIVING this?,2024-11-27,4331,349,0,9,2024,Nov
112,Lambda function as a key function to a sort,2024-11-27,5803,366,0,3,2024,Nov
113,The SECRET To Landing a Software Engineering Internship 🤫,2024-11-27,15650,779,0,38,2024,Nov
114,Is this the BEST Monitor for Programmers? #RD320U #BenQ #Programmingmonitor,2024-11-27,8121,285,0,9,2024,Nov
115,Kevin and I were chatting about the coding program - Did you know...,2024-11-26,2970,141,0,8,2024,Nov
116,Have you ever heard about the one line anonymous function?,2024-11-26,13329,821,0,11,2024,Nov
117,Full transparency...,2024-11-25,4391,279,0,11,2024,Nov
118,Python Functions: Lambda Function With Filter Function,2024-11-25,5794,405,0,5,2024,Nov
119,Do you agree?,2024-11-24,5911,324,0,13,2024,Nov
120,Learn React With This ONE Project,2024-11-24,56248,2187,0,112,2024,Nov
121,Starting from scratch as a programmer?,2024-11-24,10304,490,0,14,2024,Nov
122,The truth is...,2024-11-23,5282,281,0,10,2024,Nov
123,Python Functions: Timeit Function,2024-11-23,6830,487,0,7,2024,Nov
124,Let’s talk about how long it took me to make money with coding!,2024-11-23,26518,1166,0,25,2024,Nov
125,"Chatted about coding, passion, and why I chose this path 10 years ago. 🎙️",2024-11-22,5139,326,0,13,2024,Nov
126,Python Functions: The Pickle Function,2024-11-22,14263,850,0,16,2024,Nov
127,Python Functions: The Data Class Function,2024-11-21,11123,706,0,11,2024,Nov
128,Tutorial: Python Enumerate Function,2024-11-20,5702,416,0,6,2024,Nov
129,Tutorial: Python Counter Function,2024-11-20,5968,437,0,9,2024,Nov
130,Ever used Python’s pprint function? It’s a game-changer,2024-11-19,13164,940,0,21,2024,Nov
131,How to Create a FastAPI & React Project - Python Backend + React Frontend,2024-11-19,33555,1146,0,62,2024,Nov
132,Want to work at Apple?,2024-11-18,4680,293,0,9,2024,Nov
133,You need to know about live share if you're a Python developer and work in VSCode.,2024-11-18,7104,420,0,9,2024,Nov
134,Wanna code for Netflix?,2024-11-17,6747,402,0,23,2024,Nov
135,The easiest way to document your Python code!,2024-11-17,9600,602,0,5,2024,Nov
136,Cracking the code to land a job at Google👀,2024-11-16,22215,1169,0,54,2024,Nov
137,Tutorial: How to test your Python code,2024-11-16,21835,1670,0,26,2024,Nov
138,Coding Will NEVER Be The Same - Insane New AI Code Editor…,2024-11-15,68159,1916,0,239,2024,Nov
139,Tutorial: F-string debugging,2024-11-15,4526,368,0,7,2024,Nov
140,Can you solve this problem? 🫡👆,2024-11-15,22597,1098,0,45,2024,Nov
141,Looking at the old way of formatting Strings,2024-11-14,5588,329,0,6,2024,Nov
142,"For all the beginner Full-stack Developers, this one is for you🫡",2024-11-14,8440,516,0,14,2024,Nov
143,Build a Python AI Image Generator in 15 Minutes (Free & Local),2024-11-14,27614,1121,0,62,2024,Nov
144,When did you first start coding?,2024-11-13,3280,283,0,16,2024,Nov
145,Have you ever tried this trick in F String?,2024-11-13,5902,395,0,8,2024,Nov
146,The one thing that sets a good developer apart from an average one.,2024-11-12,5709,385,0,7,2024,Nov
147,Devs do you do this before building?,2024-11-12,4574,365,0,9,2024,Nov
148,Tutorial: Ever written code like this?,2024-11-11,37414,1855,0,39,2024,Nov
149,Tutorial: Caught yourself making this coding mistake?,2024-11-11,23905,1206,0,27,2024,Nov
150,JavaScript Speed Course - Learn JavaScript in ~75 Minutes,2024-11-11,19143,948,0,57,2024,Nov
151,First developer job...,2024-11-10,112815,5178,0,28,2024,Nov
152,Any gamers here? 🎮,2024-11-10,8539,501,0,39,2024,Nov
153,How did your first interview go as a software developer?,2024-11-09,3635,275,0,8,2024,Nov
154,5 reasons you would wanna switch,2024-11-09,10292,669,0,69,2024,Nov
155,Part 2 :,2024-11-08,4290,253,0,5,2024,Nov
156,Part 1:,2024-11-08,9940,509,0,18,2024,Nov
157,Learn Go With This ONE Project,2024-11-08,17097,672,0,36,2024,Nov
158,Are you more interested in building UI?,2024-11-07,5647,400,0,13,2024,Nov
159,Why you might want to skip Python in 2024,2024-11-07,18059,839,0,63,2024,Nov
160,"Are you just a ""hobby programmer""?",2024-11-06,7716,536,0,12,2024,Nov
161,Python Unpacking trick you probably didn't know about,2024-11-05,24960,1539,0,15,2024,Nov
162,Best programming language to start with in 2024 for beginners.,2024-11-05,8151,482,0,16,2024,Nov
163,Automate Your Life Using Python! (Email Unsubscribe with Python Tutorial),2024-11-05,26441,1139,0,51,2024,Nov
164,The Mindset of Successful Programmers,2024-11-04,7647,512,0,8,2024,Nov
165,1 year vs 10 years as a programmer,2024-11-04,6594,451,0,7,2024,Nov
166,Hidden Features in Pythons Print Function!,2024-11-03,35990,2154,0,22,2024,Nov
167,"To be a software developer in 2024, you have to do much more than just code...",2024-11-03,13314,741,0,6,2024,Nov
168,Here’s why I use the Command Line,2024-11-02,14853,820,0,12,2024,Nov
169,What country are you from? 🌍 Drop it in the comments!,2024-11-02,6715,482,0,148,2024,Nov
170,5 Useful f String Tricks - For Python,2024-11-02,17816,1130,0,32,2024,Nov
171,Hidden Python operator that will make your code 3x shorter,2024-11-02,58032,2539,0,70,2024,Nov
172,3 main things you need to include in your Programming Resume,2024-11-01,10059,568,0,7,2024,Nov
173,"Before you can become a Front-end Developer, you need to learn these 3 core things",2024-10-31,11162,563,0,14,2024,Oct
174,How to become a backend developer in 2024,2024-10-31,22123,1080,0,25,2024,Oct
175,"As a backend developer, you must be comfortable and pretty skilled in this area!",2024-10-30,6151,407,0,6,2024,Oct
176,What To Learn To Become a Python Backend Developer In 2024+,2024-10-30,36184,1628,0,67,2024,Oct
177,frontend 🤝backend development #softwareengineer #softwaredeveloper #coding,2024-10-29,8185,499,0,10,2024,Oct
178,Python is an interesting programming language.,2024-10-29,95406,4029,0,30,2024,Oct
179,Why doesn't anyone talk about this Python Trick?,2024-10-28,56205,3795,0,53,2024,Oct
180,"To be a Python dev, you’ll need more than just Python.",2024-10-28,47449,2710,0,34,2024,Oct
181,The best prep HACK to crush your software developer interview,2024-10-27,5198,261,0,7,2024,Oct
182,Fail fast so you can learn and move forward!,2024-10-27,3494,211,0,9,2024,Oct
183,How to stand out as a software developer in 2024,2024-10-26,7632,434,0,3,2024,Oct
184,The Importance Of Feedback,2024-10-26,3327,212,0,7,2024,Oct
185,14 Hours of Python Game Development - from Beginner to Advanced,2024-10-26,72680,3198,0,85,2024,Oct
186,Detach your ego from what you're building.,2024-10-25,2903,211,0,6,2024,Oct
187,Will AI help you write your code faster?,2024-10-25,9232,491,0,5,2024,Oct
188,PROJECTS! 🎯,2024-10-24,4066,341,0,12,2024,Oct
189,It’s tempting to dive right into the code editor and start building.,2024-10-24,3298,208,0,2,2024,Oct
190,What if I told you...,2024-10-23,4492,343,0,11,2024,Oct
191,This is the one thing you need to focus on first!,2024-10-23,4560,325,0,13,2024,Oct
192,"ADVANCED Python AI Multi-Agent Tutorial (RAG, Streamlit, Langflow & More!)",2024-10-23,51937,1705,0,166,2024,Oct
193,"It's about being resourceful! Learn to use different AI tools to work smarter, not harder.",2024-10-22,6998,403,0,7,2024,Oct
194,The real growth happens when you push your limits and take on the challenges that scare you 🚀,2024-10-22,3963,357,0,17,2024,Oct
195,These are the moments where I build my confidence as a programmer!,2024-10-21,4643,341,0,7,2024,Oct
196,You ready for that next level? 🚀,2024-10-21,2697,238,0,10,2024,Oct
197,There’s no magic formula for becoming a great programmer,2024-10-20,6311,449,0,11,2024,Oct
198,Streamlit Mini Course - Make Websites With ONLY Python,2024-10-20,47275,1804,0,87,2024,Oct
199,Many beginner software engineers often gravitate toward frontend development...,2024-10-20,22939,803,0,46,2024,Oct
200,What is your thought process when you code?💭,2024-10-19,5455,361,0,8,2024,Oct
201,One thing I wish I had known when I started programming,2024-10-19,5999,335,0,4,2024,Oct
202,"99% of the time, your work as a software engineer is all about…",2024-10-18,14415,723,0,16,2024,Oct
203,How to land a job or internship in coding?,2024-10-18,5225,358,0,6,2024,Oct
204,What non-programming skills are essential for software engineers?,2024-10-17,13733,606,0,8,2024,Oct
205,Is Python a great language for 13-year-olds?,2024-10-17,12524,487,0,51,2024,Oct
206,Cursor Tutorial for Beginners (AI Code Editor),2024-10-17,129410,3131,0,156,2024,Oct
207,Programming can give you the freedom to...,2024-10-16,9435,669,0,17,2024,Oct
208,The biggest mistake most beginner coders make is thinking they can simply watch “other people” code.,2024-10-16,15079,667,0,6,2024,Oct
209,“How do I get good at programming?” Listen to this.👨‍💻👆,2024-10-15,33123,1664,0,23,2024,Oct
210,"If you’re new to programming, then stick around and listen.👆",2024-10-15,3875,282,0,6,2024,Oct
211,The best programmers in the world are not experts in one specific framework or language.,2024-10-15,25637,990,0,16,2024,Oct
212,Do you strategise before diving into coding?,2024-10-14,6049,442,0,5,2024,Oct
213,My Tech Startup Failed...,2024-10-14,68393,3073,0,235,2024,Oct
214,Mastering the basics of a language is one thing...,2024-10-13,9218,583,0,10,2024,Oct
215,How do you practice programming?,2024-10-13,21095,1088,0,16,2024,Oct
216,What exactly does it mean to develop pattern recognition?,2024-10-12,6492,376,0,6,2024,Oct
217,How do you familiarise yourself with a new topic in the coding space?,2024-10-12,4652,251,0,3,2024,Oct
218,Do you think you're serious about pursuing a career as a Software Developer?,2024-10-11,13720,827,0,11,2024,Oct
219,How do you know what you are supposed to learn?,2024-10-11,4952,290,0,8,2024,Oct
220,"2 years ago, I joined a tech startup and wrote over 100,000 lines of code😱",2024-10-10,71081,2843,0,51,2024,Oct
221,Wondering whether to use Mac or Windows for programming?,2024-10-10,46608,1501,0,49,2024,Oct
222,5 Nooby Coding Mistakes You NEED To Avoid,2024-10-10,21404,1004,0,85,2024,Oct
223,"If you are becoming a Software Engineer, the worst mistake you can make is not having this!",2024-10-09,10777,517,0,9,2024,Oct
224,Feeling overwhelmed with questions when starting your freelance journey?,2024-10-09,4639,267,0,5,2024,Oct
225,This is the number one way to improve how you will learn coding.,2024-10-08,6772,550,0,10,2024,Oct
226,This is where most coders get it wrong!,2024-10-08,25390,1415,0,30,2024,Oct
227,Make Your First $500 Freelance Coding,2024-10-07,29800,1550,0,17,2024,Oct
228,Don’t make the same mistake I did in my first 3 years of coding.,2024-10-07,23030,1088,0,13,2024,Oct
229,4 Software Developer Roadmaps For 2024+,2024-10-07,96947,4190,0,172,2024,Oct
230,How can you truly stand out and land a job as a developer?,2024-10-06,41509,1666,0,88,2024,Oct
231,Want to become great at programming? Start with this.,2024-10-06,11413,737,0,11,2024,Oct
232,The 5 HIGHEST PAYING coding niches that you can get into,2024-10-05,9620,573,0,14,2024,Oct
233,Coding has changed a lot.,2024-10-05,18767,1075,0,24,2024,Oct
234,Breaks are key to avoiding burnout... but too many? Can they mess with your flow?,2024-10-04,6319,347,0,7,2024,Oct
235,Why most software engineers prefer to work in the United States rather than in Canada,2024-10-04,83932,2723,0,81,2024,Oct
236,VSCode Features Python Devs NEED To Know,2024-10-04,51677,2504,0,66,2024,Oct
237,Let's break down which backend language is best for you!,2024-10-03,70649,2778,0,82,2024,Oct
238,Python vs. JavaScript,2024-10-03,17031,838,0,27,2024,Oct
239,Do you agree with this take on programmers?,2024-10-01,6582,385,0,7,2024,Oct
240,To learn is to struggle,2024-10-01,8417,608,0,20,2024,Oct
241,TypeScript Full Course - From Beginner to Advanced,2024-10-01,185896,2141,0,72,2024,Oct
242,Learn JavaScript With These 5 Projects,2024-09-28,27789,1132,0,45,2024,Sep
243,Learn Python With 5 Projects - From Beginner to Advanced,2024-09-24,67197,2338,0,65,2024,Sep
244,How To Think Like A Developer - Fix This Or Keep Struggling…,2024-09-21,27807,1480,0,71,2024,Sep
245,Check Out This INSANE AI Web Scraper,2024-09-20,136850,6400,0,91,2024,Sep
246,OpenAI's o1 Model - Is it Over For Software Developers,2024-09-18,70532,2401,0,518,2024,Sep
247,Python AI Voice Assistant & Agent - Full Tutorial,2024-09-16,107418,3881,0,222,2024,Sep
248,These Coding Niches Will Make You $$$$ in 2024,2024-09-15,25229,1306,0,21,2024,Sep
249,How To Make Money From Coding - A Complete Guide,2024-09-12,179986,8073,0,431,2024,Sep
250,Learn To Code Like a PRO and Not Waste Time,2024-09-09,55335,2501,0,105,2024,Sep
251,5 Ways I Use AI To Automate My Life (as a senior developer),2024-09-06,20488,730,0,39,2024,Sep
252,I Reviewed 200 Developer Resumes - They Were Shocking...,2024-09-02,39539,1547,0,176,2024,Sep
253,Python AI Web Scraper Tutorial - Use AI To Scrape ANYTHING,2024-08-30,225986,8128,0,218,2024,Aug
254,PLEASE Learn These 10 Advanced Python Features,2024-08-26,54967,1961,0,54,2024,Aug
255,5 Unique Python AI Project Ideas & HOW To Build Them,2024-08-23,56607,2038,0,59,2024,Aug
256,10 Python Functions That Will Simplify Your Life,2024-08-18,63202,2435,0,103,2024,Aug
257,Why I Dropped Out of My Computer Science Degree,2024-08-15,15190,655,0,123,2024,Aug
258,A Python Developers Guide to AI in 2024,2024-08-12,47432,2022,0,56,2024,Aug
259,Build a Python Website in 15 Minutes With Streamlit,2024-08-08,91293,3303,0,100,2024,Aug
260,How I Would Learn Python in 2024 (if I could start over),2024-08-05,128245,5622,0,208,2024,Aug
261,Full Stack AI Web App Tutorial (TypeScript/React/AI/LLMs),2024-08-02,16138,572,0,25,2024,Aug
262,A CRITICAL Interview Tip for Software Developers,2024-07-30,11072,540,0,7,2024,Jul
263,Want to Actually GET GOOD at Programming? Try THIS,2024-07-29,13682,952,0,7,2024,Jul
264,Create a LOCAL Python AI Chatbot In Minutes Using Ollama,2024-07-27,141803,4676,0,189,2024,Jul
265,Problem Solving Techniques For Programming - How To Actually Get Good,2024-07-22,26613,1208,0,48,2024,Jul
266,The Truth About Learning Python in 2024,2024-07-17,81755,2565,0,144,2024,Jul
267,Master Python With This ONE Project!,2024-07-12,126551,4597,0,153,2024,Jul
268,Docker + GenAI | How To Deploy AI Apps,2024-07-09,15428,588,0,25,2024,Jul
269,Building a $1500 AI Chat Bot in 20 Minutes - Full Tutorial,2024-07-04,33233,1196,0,99,2024,Jul
270,Python Lambda Functions Explained,2024-06-29,46255,1728,0,43,2024,Jun
271,You Got Your Computer Science Degree... Now What?,2024-06-25,16818,743,0,135,2024,Jun
272,10 Useful Python Modules You NEED to Know,2024-06-21,38890,1888,0,68,2024,Jun
273,How To Practice Programming So You Actually Get Good,2024-06-18,201146,9229,0,199,2024,Jun
274,PLEASE Learn These Features of Python Functions,2024-06-13,26513,1027,0,45,2024,Jun
